{
  "$schema": "https://json-schema.org/draft/2020-12/schema",
  "$id": "https://cloudhal.dev/schemas/v1/menu.schema.json",
  "title": "Menu",
  "description": "A named navigation menu of a site (e.g. 'primary', 'footer', 'sidebar'): an ordered tree of items. Items point at pages, entries and terms by id, so renames and slug changes never break them; an item whose target is gone, retired or unpublished is hidden by the renderer, never rendered as a dead link (RFC-0003).",
  "type": "object",
  "additionalProperties": false,
  "required": [
    "schemaVersion",
    "id",
    "siteId",
    "key",
    "maxDepth",
    "items",
    "rev",
    "createdAt",
    "updatedAt"
  ],
  "properties": {
    "schemaVersion": { "$ref": "common.schema.json#/$defs/SchemaVersion" },
    "id": { "$ref": "common.schema.json#/$defs/Id" },
    "siteId": { "$ref": "common.schema.json#/$defs/Id" },
    "key": {
      "$ref": "common.schema.json#/$defs/Slug",
      "description": "Where themes place the menu ('primary', 'footer', 'sidebar', …). Unique per site and immutable once created."
    },
    "maxDepth": {
      "type": "integer",
      "description": "Deepest level an item may sit at; top-level items are level 1. The store refuses deeper trees.",
      "minimum": 1,
      "maximum": 6
    },
    "items": {
      "type": "array",
      "description": "Top-level items in display order. Empty means the site deliberately shows no items here (a missing menu means the theme's derived default).",
      "items": { "$ref": "#/$defs/MenuItem" },
      "maxItems": 100
    },
    "rev": { "$ref": "common.schema.json#/$defs/Revision" },
    "createdAt": { "$ref": "common.schema.json#/$defs/Timestamp" },
    "updatedAt": { "$ref": "common.schema.json#/$defs/Timestamp" },
    "metadata": { "$ref": "common.schema.json#/$defs/Metadata" }
  },
  "$defs": {
    "MenuLabels": {
      "type": "object",
      "description": "Item label per locale; plain text, no control characters or surrounding whitespace. A locale without a label falls back to the default locale's label, then to the target's own title or name.",
      "propertyNames": { "$ref": "common.schema.json#/$defs/Locale" },
      "minProperties": 1,
      "additionalProperties": {
        "type": "string",
        "minLength": 1,
        "maxLength": 100,
        "pattern": "^[^\\s\\x00-\\x1F\\x7F](?:[^\\x00-\\x1F\\x7F]*[^\\s\\x00-\\x1F\\x7F])?$"
      }
    },
    "MenuDisplay": {
      "type": "string",
      "description": "RFC-0025 25d (RFC-0003 amendment): how a top-level item with children opens in the header. `mega`: one wide panel, its children as columns (a group's children are the column's links).",
      "enum": ["mega"]
    },
    "MenuItem": {
      "description": "One item, discriminated by `kind` (what it links to). Children, in display order, form the tree; an item has exactly one parent by construction, so the tree has no cycles.",
      "oneOf": [
        {
          "type": "object",
          "title": "PageMenuItem",
          "description": "Links to a page by id; the label falls back to the page title.",
          "additionalProperties": false,
          "required": ["id", "kind", "pageId"],
          "properties": {
            "id": { "$ref": "common.schema.json#/$defs/Id" },
            "kind": { "type": "string", "enum": ["page"] },
            "pageId": { "$ref": "common.schema.json#/$defs/Id" },
            "labels": { "$ref": "#/$defs/MenuLabels" },
            "display": { "$ref": "#/$defs/MenuDisplay" },
            "children": {
              "type": "array",
              "items": { "$ref": "#/$defs/MenuItem" },
              "minItems": 1,
              "maxItems": 100
            }
          }
        },
        {
          "type": "object",
          "title": "EntryMenuItem",
          "description": "Links to a content entry by id (at /<collection>/<slug>); the label falls back to the entry title.",
          "additionalProperties": false,
          "required": ["id", "kind", "entryId"],
          "properties": {
            "id": { "$ref": "common.schema.json#/$defs/Id" },
            "kind": { "type": "string", "enum": ["contentEntry"] },
            "entryId": { "$ref": "common.schema.json#/$defs/Id" },
            "labels": { "$ref": "#/$defs/MenuLabels" },
            "display": { "$ref": "#/$defs/MenuDisplay" },
            "children": {
              "type": "array",
              "items": { "$ref": "#/$defs/MenuItem" },
              "minItems": 1,
              "maxItems": 100
            }
          }
        },
        {
          "type": "object",
          "title": "TermMenuItem",
          "description": "Links to a term's archive by term id; the label falls back to the term name in the locale.",
          "additionalProperties": false,
          "required": ["id", "kind", "termId"],
          "properties": {
            "id": { "$ref": "common.schema.json#/$defs/Id" },
            "kind": { "type": "string", "enum": ["term"] },
            "termId": { "$ref": "common.schema.json#/$defs/Id" },
            "labels": { "$ref": "#/$defs/MenuLabels" },
            "display": { "$ref": "#/$defs/MenuDisplay" },
            "children": {
              "type": "array",
              "items": { "$ref": "#/$defs/MenuItem" },
              "minItems": 1,
              "maxItems": 100
            }
          }
        },
        {
          "type": "object",
          "title": "CollectionMenuItem",
          "description": "Links to the index of a content collection, wherever the theme serves it. Collections have no node and no title, so labels are required.",
          "additionalProperties": false,
          "required": ["id", "kind", "collection", "labels"],
          "properties": {
            "id": { "$ref": "common.schema.json#/$defs/Id" },
            "kind": { "type": "string", "enum": ["collection"] },
            "collection": { "$ref": "common.schema.json#/$defs/Slug" },
            "labels": { "$ref": "#/$defs/MenuLabels" },
            "display": { "$ref": "#/$defs/MenuDisplay" },
            "children": {
              "type": "array",
              "items": { "$ref": "#/$defs/MenuItem" },
              "minItems": 1,
              "maxItems": 100
            }
          }
        },
        {
          "type": "object",
          "title": "UrlMenuItem",
          "description": "Links to an external https URL. The host is ASCII (internationalised names in punycode) and carries no user-info, so a label cannot hide where the link goes.",
          "additionalProperties": false,
          "required": ["id", "kind", "href", "labels"],
          "properties": {
            "id": { "$ref": "common.schema.json#/$defs/Id" },
            "kind": { "type": "string", "enum": ["url"] },
            "href": {
              "type": "string",
              "pattern": "^https://[A-Za-z0-9](?:[A-Za-z0-9.-]*[A-Za-z0-9])?(?::[0-9]{1,5})?(?:[/?#][^\\s\\\\\\x00-\\x1F\\x7F]*)?$",
              "maxLength": 2048
            },
            "newTab": {
              "type": "boolean",
              "description": "Open in a new tab (rendered with rel=\"noopener noreferrer\")."
            },
            "labels": { "$ref": "#/$defs/MenuLabels" },
            "display": { "$ref": "#/$defs/MenuDisplay" },
            "children": {
              "type": "array",
              "items": { "$ref": "#/$defs/MenuItem" },
              "minItems": 1,
              "maxItems": 100
            }
          }
        },
        {
          "type": "object",
          "title": "GroupMenuItem",
          "description": "A label without a link that holds other items: a dropdown parent or a sidebar section heading. Hidden when none of its children is shown.",
          "additionalProperties": false,
          "required": ["id", "kind", "labels", "children"],
          "properties": {
            "id": { "$ref": "common.schema.json#/$defs/Id" },
            "kind": { "type": "string", "enum": ["group"] },
            "labels": { "$ref": "#/$defs/MenuLabels" },
            "display": { "$ref": "#/$defs/MenuDisplay" },
            "children": {
              "type": "array",
              "items": { "$ref": "#/$defs/MenuItem" },
              "minItems": 1,
              "maxItems": 100
            }
          }
        }
      ]
    }
  }
}
